2025-11-04 00:12:29,261 - INFO  - Log file for this run: /root/autodl-tmp/retraining-free-quantization/eval/alexnet_cifar10_single_gpu_eval/alexnet_cifar10_single_gpu_eval.log
2025-11-04 00:12:29,409 - INFO  - Using device: cuda:0
2025-11-04 00:12:29,409 - INFO  - Bit-width config: ./search/alexnet_cifar10_single_gpu_search_bit_width_config.json
2025-11-04 00:12:29,409 - INFO  - Testing BER values: [1e-08, 1e-07, 1e-06, 1e-05, 0.0001, 0.001, 0.01, 0.02, 0.03, 0.04, 0.1]
2025-11-04 00:12:30,076 - INFO  - Created `alexnet` model for `cifar10` dataset (num_classes=10)
          Use pre-trained model = False
2025-11-04 00:12:30,077 - INFO  - Inserting quantizers into the model
2025-11-04 00:12:30,661 - INFO  - Loading checkpoint from ./training/alexnet_cifar10_single_gpu/alexnet_cifar10_single_gpu_checkpoint.pth.tar
2025-11-04 00:12:31,017 - INFO  - Ignoring 3 missing optional buffers (current_bit_cands, etc.) that were added after checkpoint was saved
2025-11-04 00:12:31,018 - INFO  - Loaded checkpoint alexnet model (next epoch 200) from ./training/alexnet_cifar10_single_gpu/alexnet_cifar10_single_gpu_checkpoint.pth.tar
2025-11-04 00:12:31,044 - INFO  - Initializing model output_size with a dummy forward pass
2025-11-04 00:12:31,256 - INFO  - ✓ Model output_size initialized
2025-11-04 00:12:31,256 - INFO  - Loading bit-width configuration from: ./search/alexnet_cifar10_single_gpu_search_bit_width_config.json
2025-11-04 00:12:31,257 - INFO  - ✓ Bit-width configuration loaded: 5 layers
2025-11-04 00:12:32,825 - INFO  - 
============================================================
2025-11-04 00:12:32,826 - INFO  - Baseline Evaluation (No Fault Injection)
2025-11-04 00:12:32,826 - INFO  - ============================================================
2025-11-04 00:12:32,826 - INFO  - Validation: 10000 samples (128 per mini-batch)
2025-11-04 00:12:34,175 - INFO  - Arch 0, BitOPs 2.32 G, Size 20.63 MB, Top-1 Acc. 87.97
2025-11-04 00:12:34,175 - INFO  - Baseline Top-1 Accuracy: 87.97%
2025-11-04 00:12:34,175 - INFO  - 
============================================================
2025-11-04 00:12:34,175 - INFO  - Fault Injection Test 1/11: BER = 1.0e-08
2025-11-04 00:12:34,175 - INFO  - ============================================================
2025-11-04 00:12:34,177 - INFO  - Validation: 10000 samples (128 per mini-batch)
2025-11-04 00:12:38,136 - INFO  - Arch 0, BitOPs 2.32 G, Size 20.63 MB, Top-1 Acc. 87.97
2025-11-04 00:12:38,137 - INFO  - BER=1.0e-08: Accuracy=87.97%, Drop=0.00%
2025-11-04 00:12:38,137 - INFO  - 
============================================================
2025-11-04 00:12:38,137 - INFO  - Fault Injection Test 2/11: BER = 1.0e-07
2025-11-04 00:12:38,137 - INFO  - ============================================================
2025-11-04 00:12:38,138 - INFO  - Validation: 10000 samples (128 per mini-batch)
2025-11-04 00:12:42,069 - INFO  - Arch 0, BitOPs 2.32 G, Size 20.63 MB, Top-1 Acc. 87.96
2025-11-04 00:12:42,069 - INFO  - BER=1.0e-07: Accuracy=87.96%, Drop=0.01%
2025-11-04 00:12:42,069 - INFO  - 
============================================================
2025-11-04 00:12:42,069 - INFO  - Fault Injection Test 3/11: BER = 1.0e-06
2025-11-04 00:12:42,069 - INFO  - ============================================================
2025-11-04 00:12:42,070 - INFO  - Validation: 10000 samples (128 per mini-batch)
2025-11-04 00:12:46,008 - INFO  - Arch 0, BitOPs 2.32 G, Size 20.63 MB, Top-1 Acc. 87.95
2025-11-04 00:12:46,008 - INFO  - BER=1.0e-06: Accuracy=87.95%, Drop=0.02%
2025-11-04 00:12:46,008 - INFO  - 
============================================================
2025-11-04 00:12:46,008 - INFO  - Fault Injection Test 4/11: BER = 1.0e-05
2025-11-04 00:12:46,008 - INFO  - ============================================================
2025-11-04 00:12:46,009 - INFO  - Validation: 10000 samples (128 per mini-batch)
2025-11-04 00:12:49,930 - INFO  - Arch 0, BitOPs 2.32 G, Size 20.63 MB, Top-1 Acc. 87.95
2025-11-04 00:12:49,930 - INFO  - BER=1.0e-05: Accuracy=87.95%, Drop=0.02%
2025-11-04 00:12:49,931 - INFO  - 
============================================================
2025-11-04 00:12:49,931 - INFO  - Fault Injection Test 5/11: BER = 1.0e-04
2025-11-04 00:12:49,931 - INFO  - ============================================================
2025-11-04 00:12:49,931 - INFO  - Validation: 10000 samples (128 per mini-batch)
2025-11-04 00:12:53,906 - INFO  - Arch 0, BitOPs 2.32 G, Size 20.63 MB, Top-1 Acc. 87.91
2025-11-04 00:12:53,906 - INFO  - BER=1.0e-04: Accuracy=87.91%, Drop=0.06%
2025-11-04 00:12:53,906 - INFO  - 
============================================================
2025-11-04 00:12:53,906 - INFO  - Fault Injection Test 6/11: BER = 1.0e-03
2025-11-04 00:12:53,906 - INFO  - ============================================================
2025-11-04 00:12:53,907 - INFO  - Validation: 10000 samples (128 per mini-batch)
2025-11-04 00:12:57,853 - INFO  - Arch 0, BitOPs 2.32 G, Size 20.63 MB, Top-1 Acc. 88.14
2025-11-04 00:12:57,853 - INFO  - BER=1.0e-03: Accuracy=88.14%, Drop=-0.17%
2025-11-04 00:12:57,853 - INFO  - 
============================================================
2025-11-04 00:12:57,853 - INFO  - Fault Injection Test 7/11: BER = 1.0e-02
2025-11-04 00:12:57,853 - INFO  - ============================================================
2025-11-04 00:12:57,854 - INFO  - Validation: 10000 samples (128 per mini-batch)
2025-11-04 00:13:01,777 - INFO  - Arch 0, BitOPs 2.32 G, Size 20.63 MB, Top-1 Acc. 82.0
2025-11-04 00:13:01,777 - INFO  - BER=1.0e-02: Accuracy=82.00%, Drop=5.97%
2025-11-04 00:13:01,777 - INFO  - 
============================================================
2025-11-04 00:13:01,777 - INFO  - Fault Injection Test 8/11: BER = 2.0e-02
2025-11-04 00:13:01,777 - INFO  - ============================================================
2025-11-04 00:13:01,778 - INFO  - Validation: 10000 samples (128 per mini-batch)
2025-11-04 00:13:05,720 - INFO  - Arch 0, BitOPs 2.32 G, Size 20.63 MB, Top-1 Acc. 68.95
2025-11-04 00:13:05,721 - INFO  - BER=2.0e-02: Accuracy=68.95%, Drop=19.02%
2025-11-04 00:13:05,721 - INFO  - 
============================================================
2025-11-04 00:13:05,721 - INFO  - Fault Injection Test 9/11: BER = 3.0e-02
2025-11-04 00:13:05,721 - INFO  - ============================================================
2025-11-04 00:13:05,722 - INFO  - Validation: 10000 samples (128 per mini-batch)
2025-11-04 00:13:09,660 - INFO  - Arch 0, BitOPs 2.32 G, Size 20.63 MB, Top-1 Acc. 48.68
2025-11-04 00:13:09,660 - INFO  - BER=3.0e-02: Accuracy=48.68%, Drop=39.29%
2025-11-04 00:13:09,660 - INFO  - 
============================================================
2025-11-04 00:13:09,660 - INFO  - Fault Injection Test 10/11: BER = 4.0e-02
2025-11-04 00:13:09,660 - INFO  - ============================================================
2025-11-04 00:13:09,661 - INFO  - Validation: 10000 samples (128 per mini-batch)
2025-11-04 00:13:13,588 - INFO  - Arch 0, BitOPs 2.32 G, Size 20.63 MB, Top-1 Acc. 29.31
2025-11-04 00:13:13,588 - INFO  - BER=4.0e-02: Accuracy=29.31%, Drop=58.66%
2025-11-04 00:13:13,588 - INFO  - 
============================================================
2025-11-04 00:13:13,589 - INFO  - Fault Injection Test 11/11: BER = 1.0e-01
2025-11-04 00:13:13,589 - INFO  - ============================================================
2025-11-04 00:13:13,591 - INFO  - Validation: 10000 samples (128 per mini-batch)
2025-11-04 00:13:17,519 - INFO  - Arch 0, BitOPs 2.32 G, Size 20.63 MB, Top-1 Acc. 9.88
2025-11-04 00:13:17,520 - INFO  - BER=1.0e-01: Accuracy=9.88%, Drop=78.09%
2025-11-04 00:13:17,520 - INFO  - 
============================================================
2025-11-04 00:13:17,520 - INFO  - Summary
2025-11-04 00:13:17,520 - INFO  - ============================================================
2025-11-04 00:13:17,520 - INFO  - BER          Accuracy     Drop        
2025-11-04 00:13:17,520 - INFO  - ------------------------------------------------------------
2025-11-04 00:13:17,520 - INFO  - Baseline     87.97        0.00        
2025-11-04 00:13:17,520 - INFO  - 1.0e-08      87.97        0.00        
2025-11-04 00:13:17,520 - INFO  - 1.0e-07      87.96        0.01        
2025-11-04 00:13:17,520 - INFO  - 1.0e-06      87.95        0.02        
2025-11-04 00:13:17,520 - INFO  - 1.0e-05      87.95        0.02        
2025-11-04 00:13:17,520 - INFO  - 1.0e-04      87.91        0.06        
2025-11-04 00:13:17,520 - INFO  - 1.0e-03      88.14        -0.17       
2025-11-04 00:13:17,520 - INFO  - 1.0e-02      82.00        5.97        
2025-11-04 00:13:17,520 - INFO  - 2.0e-02      68.95        19.02       
2025-11-04 00:13:17,520 - INFO  - 3.0e-02      48.68        39.29       
2025-11-04 00:13:17,520 - INFO  - 4.0e-02      29.31        58.66       
2025-11-04 00:13:17,520 - INFO  - 1.0e-01      9.88         78.09       
2025-11-04 00:13:17,520 - INFO  - 
Evaluation complete!
